{
  "id": "dell",
  "label": "Dell",
  "summary": "5 days a week for office-proximate roles",
  "scheme": {
    "kind": "weekly-quota",
    "daysPerWeek": 5,
    "averagingWeeks": 1,
    "bands": {
      "warn": 0.8,
      "success": 0.9
    },
    "absence": {
      "excused": ["vacation", "sick", "holiday", "oof"],
      "travelCountsAsOffice": false,
      "proration": "prorate"
    }
  },
  "target": 1,
  "holidaySet": "us-federal",
  "confidence": "reported",
  "effectiveDate": "2025-03-03",
  "geographicScope": "Within about an hour's commute of a Dell office",
  "assumptions": [
    "Vacation treatment is not publicly documented.",
    "The US federal holiday set is assumed for this preset."
  ],
  "sources": [
    {
      "label": "The Register Dell RTO report",
      "url": "https://www.theregister.com/on-prem/2025/01/31/dell-ends-hybrid-work-policy-despite-remote-work-pledge/643091"
    }
  ]
}
